{
  "schema_version": "1.0",
  "assessment": {
    "importance": "important",
    "reason_codes": ["design-choice", "high-impact", "project-direction"],
    "user_authority_required": true,
    "continue_independent_work": true
  },
  "human_interaction": {
    "schema_version": "1.0",
    "task_ref": "AR-EXAMPLE",
    "task_revision": 3,
    "interaction_required": true,
    "activation": "user-decision",
    "decision_status": "pending",
    "reason": "The allocator geometry changes the public design direction.",
    "requested_by": "agent",
    "decision_request_ref": "AWG-EXAMPLE-DECISION",
    "tui_contract_version": "1.0"
  },
  "tui_route": {
    "channel": "workflow-ui",
    "request_ref": "AWG-EXAMPLE-DECISION",
    "host_direct_question_forbidden": true,
    "preferred_backend": "gui",
    "fallback_backend": "tui"
  }
}
